メールアドレスを変更したいのですが、どうすれば良いですか？,【えがおWEB会員の方】<br />えがおWEB会員の方は、マイページに下記よりログインして頂き「登録内容の変更／確認」にて変更をお願い致します。<br />※変更して頂いたアドレスが、ログイン時のIDとなりますので変更後は新しいアドレスでログインしてください。<br />【えがおWEB会員ではない方】<br />お手数ですが、下記よりご連絡いただきますようよろしくお願い致します。
フィーチャーフォンからスマートフォン（スマートフォンからフィーチャーフォン）へ変更しましたが、どうすれば良いですか？,【えがおWEB会員の方】<br />えがおWEB会員の方は、マイページにログインされ、「登録内容の変更／確認」より、アドレス種別の変更をお願いいたします。<br />※アドレス種別：PC・スマホアドレスもしくは携帯アドレスなど、ご利用のEメールアドレスの種類です。<br />【えがおWEB会員ではない方】<br />お手数ですが、下記よりご連絡いただきますようよろしくお願い致します。
どのような場所に保管すれば良いですか？,なるべく涼しい場所に保管することを、おすすめ致します。<br />特に、ソフトカプセル状の商品は急激な温度変化や湿度に敏感です。<br />下記のようなことにご注意ください。<br />① 濡れた手で商品を袋から取り出すのはお止めください。<br />② 必ずチャックを閉めて保管してください。<br />③ 直射日光が当たる場所には置かないでください。<br />④ 熱をもつ電化製品（パソコンやレンジ）や、暖房器具の噴出し口周辺には置かないでください。<br />⑤ 冷蔵庫内での保管はお控えください。
冷蔵庫で保管して良いですか？,冷蔵庫での保管はなるべくお控えくださいますよう、よろしくお願い致します。<br />冷蔵庫への出し入れにより結露が発生しやすくなったり、<br />ソフトカプセル状の商品は、固くなって割れやすくなったりすることがあります。
携帯ケースでの保管期間の目安はどれくらいですか？,携帯ケースをご利用の場合は、2～3日飲まれる量を目安とし、お早めにお召し上がりいただくことを、おすすめ致します。
メールマガジンの受信を止めたい。,メールマガジンの解約でございますね。<br /><br />【えがおWEB会員の方】<br />マイページ内での受信停止手続きもできます。ぜひ、ご利用くださいませ。<br />【えがおWEB会員ではない方】<br />下記のリンク先より、メルマガ解約の旨お申しつけくださいませ。<br />※受信停止手続きをして頂いた後、2週間ほど行き違いでメールマガジンが届く場合もありますのでご了承ください。
メールマガジンの文章や画像が表示されません。,文章や画像が表示されないということでございますね。<br />まずはメールマガジンの最上部にございます「※画像がうまく表示されない方はこちらからどうぞ」から、 ページがご覧いただけたかどうかお試しいただいてもよろしいでしょうか。<br />ご確認いただいても、メールにて表示されない場合は、至急、原因を確認させていただきたく存じますので、下記内容の詳細をご記載の上、お問い合わせいただきますようお願いいたします。<br />・ご利用環境（例：Windows7、Windows Vista・・・）<br />・ご使用のブラウザとバージョン（例：Interner Explore9.0、Google Chrome、Firefox・・・）<br />・ご使用のメーラー（例：Outlook Express、Hotmail・・・）
えがおのお問い合わせ先を教えてください。,【お電話の場合】<br />0120-241-241<br />※受付時間 6：00～24：00 年中無休<br />【メールの場合】<br />※平日17：00まで営業しております。土日祝日を挟みますとご返信が遅れる場合があります事ご了承ください。<br />【Faxの場合】<br />0120-77-7733
えがおからのメールが届きません。,ご迷惑をお掛けしております。下記の点をご確認くださいませ。<br />【注文完了などのメールが届かない方】<br />以下のような事が考えられます。お手数ですが、ご確認の程よろしくお願い致します。<br />(1) 迷惑メールフォルダに入っている<br />(2) 「@241241.jp」を受信できる設定になっていない。<br />※それでもメールの確認ができなかった場合は、お手数ですが下記のお問い合わせ先よりご連絡頂きますと幸いです。
ログインID（メールアドレス）を忘れたので、ログインが出来ません。,ご登録頂いたアドレスが分からない場合は、下記のお問い合わせフォームよりご連絡下さい。
パスワードを忘れたのでログインができません。,【登録メールアドレスを変更されていない方】<br />まず、下記よりパスワードの再設定手続きをおこなってください。<br />【登録メールアドレスもパスワードもお忘れになった方】<br />下記のお問い合わせフォームよりご連絡いただきますと幸いです。
ログインできないのですが、どうしたらいいですか？,ご迷惑をお掛けしております。<br />再度、下記の点をご確認願います。<br />【メールアドレスについて】<br />メールアドレスに小文字、大文字の相違はありませんか？<br />全角、半角、記号 '-'、'.' などの相違はありませんか？<br />メールアドレスの末尾などに、不要なスペースは入っていませんか？<br />【パスワードについて】<br />パスワードを忘れた方は、下記のリンク先よりメールアドレスを入力して送信してください。<br />入力頂いたメールアドレス宛てにパスワード変更手続き用のメールをお送り致します。<br />【その他の方法】<br />何度もログインを試される方が解決に至った方法をご紹介いたします。<br />＜履歴の消去＞<br />現在お使いの「ブラウザー名」（Firefox 、Internet Explorer、GoogleCrome　など）＋「クッキー消去方法」で検索してください。多くのサイトに、履歴の消去方法が紹介されています。<br />履歴の消去を行い、再度ログインを試みると解決する場合が多いようです。<br />ログインできずに困っている方の多くが、この方法で解決されています。<br />＜自動入力を削除＞<br />ご利用の端末によりましては、過去にアクセスしたサイト履歴をブラウザーで一時的に保管したデータ「キャッシュ」が残っていることがございます。<br />ログイン画面にてメールアドレスやパスワードが自動で入力されている場合は、下記方法にてお試しください。<br />1）閲覧履歴に残っていたり、ブックマーク登録などからのアクセスではなく、「えがお」で検索して、弊社公式ページへアクセスする<br />2）マイページへのログイン画面にて、メールアドレスやパスワードが自動で入力されている場合は、すべて削除（除去）し、ご登録いただいているメールアドレス・パスワーにをいちから入力する<br />【それでもログインできなかった方】<br />えがおWEB会員登録時にお送りした、登録完了メールを検索してパスワードのご確認をお願い致します。<br />もしくは、お手数ですが、下記のリンク先よりご連絡の程、よろしくお願い致します。
ログイン時の登録メールアドレスを変更したいのですが、どのようにすればいいですか？,現在ご登録いただいているメールアドレスで、一度「マイページ」にログインをお願いいたします。<br />ログイン後、「お客様情報の確認と変更」という表示が出てまいりますので、クリックしていただき、ご希望のメールアドレスへと変更をお願いします。<br />ご登録メールアドレス、パスワードともにお忘れの場合は、以下の問い合わせフォームより、その旨ご連絡ください。
えがおWEB会員になると何が利用できるの？,えがおWEB会員の方は、お客様専用の「マイページ」という便利な機能がご利用いただけます。ご利用いただける機能は、以下をご確認ください。<br />・お振込用紙再発行<br />・住所・メールアドレス・電話番号の変更<br />・贈答先住所、お客様自身の住所変更<br />・定期でお届けしている商品の（袋数）（お届け日）（お届け間隔）の変更<br />・えがおWEB会員登録後の注文状況確認<br />・お得な定期契約の解約<br />・えがおポイントの交換
えがおWEB会員の登録はどうしたらできますか？,えがおWEB会員の登録は、下記のリンクをクリックし「えがおWEB会員登録はこちらから」をクリックしてください。
えがおWEB会員の登録には会費は必要ですか？,会費は必要ではありません。無料でご登録頂けますので、ご安心ください。
えがおWEB会員を退会したいのですが、どうすれば良いですか？,えがおWEB会員様マイページより会員退会を承っております。<br />ログイン後、右側にありますメニューバーの中の「退会」ボタンを押していただき、退会手続きをよろしくお願いいたします。
「えがおポイント」とはなんですか？,「えがおポイント」は、購入金額に応じてポイントが付与され、ポイントがたまると、ご希望の商品と交換することができるサービスです。<br />商品をご購入いただくごとに、100円（税込）につき1ポイント付与いたします。<br />50ポイントからでも交換できる商品をはじめ、食品・雑貨・えがおの商品まで充実した商品が揃ったポイントサービスをぜひご利用ください。
有効期限内でも保有ポイントがなくなってしまうことはありますか？,1年間えがおの商品のご購入がない場合、保有ポイントは0ポイントになります。<br />あらかじめご了承くださいませ。
どのような商品と交換できますか？,下記リンク先にてご確認いただけますので、ぜひご覧くださいませ。
ポイントを交換したいのですが、どのようにしたらいいですか？,Ｗｅｂ上での交換は、えがおWEB会員様マイページ内でのお手続きとなります。<br /><br />【えがおWEB会員の方】<br />マイページにログインしていただき、「ポイント交換」より交換商品の確認、交換が可能です。<br /><br />【えがおWEB会員ではない方】<br />お手数ではございますが、会員登録をお願いしたします。
持っているポイント数を確認するにはどのようにしたらいいですか？,お客様がお持ちのポイント数は、商品をお届けする際の「お届け明細書」にてご確認いただけます。<br />なお、えがおWEB会員様でございましたら、マイページ内でもご確認いただけます。<br />マイページにログインしていただき、「ポイント交換」よりご確認くださいませ。
支払いのときに「えがおポイント」は利用できますか？,「えがおポイント」は、カタログからご希望の商品とえがおポイントを交換することができるサービスです。商品ご購入の際には、ご利用いただけませんこと、何とぞご了承ください。<br />交換商品につきましては、下記リンク先にてご確認いただけますので、ぜひご覧くださいませ。
ポイントを交換しましたが、いつごろ届きますか？,お申し込みいただいたポイント交換商品のお届けは、お申込受付から2週間以内でお届けいたします。詳細のご質問がございましたら、下記よりお問い合わせください。
クロスワードパズルに応募したいのですが、ホームページではどうすれば応募できますか？,クロスワードパズルの応募は、応募フォームより承っております。<br />ご応募、お待ちしております。
ふりふりシェーカーが欲しいのですが、どうしたらいいですか？,ふりふりシェーカーは、初めて青汁商品をご購入いただいた際のプレゼントとしてお送りしております。<br />基本はお一人様1本までとなっておりますが、破損した場合やご家族様と別々にお使いいただく場合などは、1本270円（税込）でご購入いただけます。ご希望ございましたら、下記お問い合わせフォームよりご連絡をお願いいたします。<br />※デザインは予告なく変更する場合があります。ご了承ください。
他の人を紹介すると特典はありますか？,ご紹介で商品を購入いただくと、ご紹介いただいた方、ご紹介された方のお二人に素敵なプレゼントをご用意しています。<br />プレゼント品やご注文方法など詳細は、下記よりお問い合わせください。
推奨環境を教えてください。,本サイトを快適にご利用いただくため、以下の環境を推奨いたします。<br />下記以外の環境下では正常な表示、動きでページをご覧いただけない場合がございます。<br />■推奨ブラウザ<br />【PC】<br />・Internet Explorer　11<br />・Chrome:最新版<br />・FireFox：最新版<br /><br />【スマートフォン】<br />・Android：Android4系<br />・iOS：最新8.2
メールが文字化けする,お客様のパソコンの設定が影響し、文字化けして表示されることがございます。<br />下記手順を参考に、設定いただきますと解消されることがございますので、<br />お手数ではございますが、お試しくださいますようお願いいたします。<br />[表示]→[エンコード]→[Unicode(UTF-8)]を選択。<br />なお、やはり文字化けしてしまう場合は、弊社にていったんお調べさせていただきたく<br />存じますので、下記内容をあわせて、ご連絡くださいますようお願いいたします。<br />・ご利用環境（例：Windows7、Windows Vista・・・）<br />・ご使用のブラウザとバージョン（例：Interner Explore9.0、Google Chrome、Firefox・・・）<br />・ご使用のメーラー（例：Outlook Express、Hotmail・・・）
